Name,Role,Company,Website,Email,Notes,Member,Template
"Willi GeserSenior Leader, External Collaboration & University Relations3Mhttps://www.3m.com/wgeser@mmm.comNo longer an active 3M employeeAugieMonetary Outreach Templates - Google Docs",,,,,,,
"John BanovetzEVP, CTO & Environmental Responsibility3Mhttps://www.3m.com/jbanovetz@mmm.comAugieMonetary Outreach Templates - Google Docs",,,,,,,
"Torie ClarkeEVP, Chief Public Affairs Officer3Mhttps://www.3m.com/torie.clarke@mmm.comAugieMonetary Outreach Templates - Google Docs",,,,,,,
Alexia WegscheidSales Operations Business Support RepresentativeDigikeyalexia.swanson@digikey.comOwenMonetary Outreach Templates - Google Docs,,,,,,,
Vishal GuravSales ExecutiveDigikeyvishal.gurav@digikey.comOwenMonetary Outreach Templates - Google Docs,,,,,,,
Kjersten WaltonAccount Development Sales - CentralDigikeykjersten.walton@digikey.comOwenMonetary Outreach Templates - Google Docs,,,,,,,
Shelby GroundAccount Development Sales - CentralDigikeyshelby.ground@digikey.comOwenMonetary Outreach Templates - Google Docs,,,,,,,
Bernard HoeselAssigned Accounts Sales RepresentativeDigikeybernhard.hosel@digikey.comOwenMonetary Outreach Templates - Google Docs,,,,,,,
Matt NemecDirector; Supplier Business DevelopmentDigikeymatt.nemec@digikey.comOwenMonetary Outreach Templates - Google Docs,,,,,,,
Mark TsuiSales repDigikeymark.tsui@digikey.comOwenMonetary Outreach Templates - Google Docs,,,,,,,
Patricia SorensonSales RepDigikeypatricia.sorenson@digikey.comOwenMonetary Outreach Templates - Google Docs,,,,,,,
Kiersten Jenson Sales RepDigikeykiersten.jenson@digikey.comOwenMonetary Outreach Templates - Google Docs,,,,,,,
"Renae MyszkowskiManager, Sales Enablement & Operations TrainingDigikeyrenae.myszkowski@digikey.comOwenMonetary Outreach Templates - Google Docs",,,,,,,
Bailey BeggsTalent Acquisition SpecialistDigikeybailey.beggs@digikey.comOwenMonetary Outreach Templates - Google Docs,,,,,,,
Kim WavraTalent Acquisition SpecialistDigikeykim.wavra@digikey.comOwenMonetary Outreach Templates - Google Docs,,,,,,,
Kailin RadekeSR Talent Acquisition SpecialistDigikeykailin.radeke@digikey.comOwenMonetary Outreach Templates - Google Docs,,,,,,,
"Stephanie HSr Manager, Learning and DevelopmentDigikeystephanie.heisser@digikey.comOwenMonetary Outreach Templates - Google Docs",,,,,,,
Mark LaingRegional Business Development ManagerDigikeymark.laing@digikey.comOwenMonetary Outreach Templates - Google Docs,,,,,,,
Kashu SuzukiBusiness Development ManagerDigikeykashu.suzuki@digikey.comOwenMonetary Outreach Templates - Google Docs,,,,,,,
"Laura StengrimManager, Public Relations and Marketing CommunicationsDigikeylaura.stengrim@digikey.comOwenMonetary Outreach Templates - Google Docs",,,,,,,
Vanessa WollinSenior Manager Business TransformationDigikeyvanessas.wollin@digikey.comOwenMonetary Outreach Templates - Google Docs,,,,,,,
Jeffrey TatumTunnel SuperintendentSuper Excavators (CRS Tunneling)jeff@superexcavators.comTunneling companyOwenMonetary Outreach Templates - Google Docs,,,,,,,
Jeff WeaklyVPSuper Excavators (CRS Tunneling)jeff@superexcavators.comTunneling companyOwenMonetary Outreach Templates - Google Docs,,,,,,,
Steve PeeChief Financial OfficerSuper Excavators (CRS Tunneling)steve@superexcavators.comTunneling companyOwenMonetary Outreach Templates - Google Docs,,,,,,,
Tony CarusoSupervisorSuper Excavators (CRS Tunneling)tonyc@superexcavators.comTunneling companyOwenMonetary Outreach Templates - Google Docs,,,,,,,
Johnathan TurnerVP ProcurementRobbinsjturner@robbinsfloor.comTBM manufacturerOwenMonetary Outreach Templates - Google Docs,,,,,,,
Steve ReidRegional Sales RepresentativeRobbinsreids@robbinstbm.comTBM manufacturerOwenMonetary Outreach Templates - Google Docs,,,,,,,
Miguel Perrichon MurguiaUtility Tunneling Sales LeaderRobbinsmurguiam@robbinstbm.comTBM manufacturerOwenMonetary Outreach Templates - Google Docs,,,,,,,
Doug HardingVP SalesRobbinshardingd@robbinstbm.comTBM manufacturerOwenMonetary Outreach Templates - Google Docs,,,,,,,
Joe LechnerSBU Sales managerRobbinslechnerjoe@robbinstbm.comTBM manufacturerOwenMonetary Outreach Templates - Google Docs,,,,,,,
"Zachary JessenManager, Enterprise Sales - AmericasDigikeyzachary.jessen@digikey.comOwenMonetary Outreach Templates - Google Docs",,,,,,,
"David SandysSenior Director, Technical MarketingDigikeydavid.sandys@digikey.comOwenMonetary Outreach Templates - Google Docs",,,,,,,
"Gabe KluverManager, Continuous ImprovementDigikeygabe.kluver@digikey.comOwenMonetary Outreach Templates - Google Docs",,,,,,,
"Pam GiesekeSr. Manager, Marketing ProductionDigikeypam.gieseke@digikey.comOwenMonetary Outreach Templates - Google Docs",,,,,,,
Jaylene LarsonPartnerships Marketing ManagerDigikeyjaylene.larson@digikey.comOwenMonetary Outreach Templates - Google Docs,,,,,,,
"Laura RudeSr Manager, Customer Development- AmericasDigikeylaura.rude@digikey.comOwenMonetary Outreach Templates - Google Docs",,,,,,,
Jill GenereuxSenior Digital Marketing ManagerDigikeyjill.genereux@digikey.comOwenMonetary Outreach Templates - Google Docs,,,,,,,
"Zoe DicksonEVP, Chief Human Resources Officer3Mhttps://www.3m.com/zdickson1@mmm.comAugieGeneral template",,,,,,,
"Stewart HallPlant Manager, 3M Denver/Montrose 3Mhttps://www.3m.com/sshall@mmm.comAugie General template",,,,,,,
"Nigel FowlerPlant Manager, 3M Denver/Montrose 3Mhttps://www.3m.com/nfowler@mmm.comAugie General template",,,,,,,
"Wendy BauerGroup President, Transportation & Electronics3Mhttps://www.3m.com/wendy.bauer@mmm.comAugie General template",,,,,,,
Leslie KaluckiHuman Resources Busniness PartnerSkanskahttps://www.usa.skanska.com/leslie.kalucki@skanska.comCivil firmJonahGeneral template,,,,,,,
Robyn WestBusiness DevelopmentSkanskahttps://www.usa.skanska.com/robyn.west@skanska.comCivil firmJonahGeneral template,,,,,,,
Heather AskinsDirector of Business DevelopmentSkanskahttps://www.usa.skanska.com/heather.askins@skanska.comCivil firmJonahGeneral template,,,,,,,
Hannah KimSenior Business Dev CordinatorSkanskahttps://www.usa.skanska.com/hannah.kim@skanska.comCivil firmJonahGeneral template,,,,,,,
Veronica GrossVice Pres - Business developmentSkanskahttps://www.usa.skanska.com/veronica.gross@skanska.comCivil firmJonahGeneral template,,,,,,,
"Mendy MazzoCorporate Senior Vice President, National Business DevelopmentSkanskahttps://www.usa.skanska.com/mendy.mazzo@skanska.comCivil firmJonahGeneral template",,,,,,,
Calvin DavisBusiness ManagerSkanskahttps://www.usa.skanska.com/calvin.davis@skanska.comCivil firmJonahGeneral template,,,,,,,
Tilley AllenBusiness ManagerSkanskahttps://www.usa.skanska.com/tilley.allen@skanska.comCivil firmJonahGeneral template,,,,,,,
"Sarah ObleskanSenior Director, Technical MarketingSkanskahttps://www.usa.skanska.com/sarah.olbekson@skanska.comCivil firmJonahGeneral template",,,,,,,
Bryan HayVice Pres - Business developmentSkanskahttps://www.usa.skanska.com/bryan.hay@skanska.comCivil firmJonahGeneral template,,,,,,,
Sara FranciniSenior Vice Pres - Business developmentSkanskahttps://www.usa.skanska.com/sara.francini@skanska.comCivil firmJonahGeneral template,,,,,,,
Steven AgorVice Pres - Business developmentSkanskahttps://www.usa.skanska.com/steve.agor@skanska.comCivil firmJonahGeneral template,,,,,,,
Yesenia VazquezHRSkanskahttps://www.usa.skanska.com/yesenia.vazquez@usa.skanska.comCivil firmJonahGeneral template,,,,,,,
Lauren MassinaHR managerSkanskahttps://www.usa.skanska.com/lauren.messina@skanska.comCivil firmJonahGeneral template,,,,,,,
Caitlan VanasHR Buisness PartnerSkanskahttps://www.usa.skanska.com/caitlan.vanas@skanska.comCivil firmJonahGeneral template,,,,,,,
Alaeden JlelatyCorporate Commeicial DirectorSkanskahttps://www.usa.skanska.com/alaeden.jlelaty@skanska.comCivil firmJonahGeneral template,,,,,,,
Eunseok ParkSemiconductor Platform New Business and Partnership Manager3Mhttps://www.3m.com/epark@3m.comMonetary outreachAugieGeneral template,,,,,,,
Michael WienerSales Leader Strategic Partnership Accounts3Mhttps://www.3m.com/mbwiener@mmm.comMonetary outreachAugieGeneral template,,,,,,,
Joseph HockettGlobal Marketing Director3Mhttps://www.3m.com/jhockett@mmm.comMonetary Outreach AugieGeneral template,,,,,,,
Melissa SinnTalen acquisition manager3Mhttps://www.3m.com/msinn@mmm.comMonetary Outreach AugieGeneral template,,,,,,,
Michael ZimmerhanzelBusiness Development Manager3Mhttps://www.3m.com/mdzimmerhanzel@mmm.comMonetary Outreach AugieGeneral template,,,,,,,
Jim McKevittBusiness Development Manager3Mhttps://www.3m.com/j-mckevitt@mmm.comMonetary Outreach AugieGeneral template,,,,,,,
Denise ThompsonBusiness Development3Mhttps://www.3m.com/dmelliott@mmm.comMonetary Outreach AugieGeneral template,,,,,,,
Paul MaturenBusiness Development Leader3Mhttps://www.3m.com/pfmaturen@mmm.comMonetary Outreach AugieGeneral template,,,,,,,
Tillana ChakrabortiMarketing Executive3Mhttps://www.3m.com/tchakraborti@mmm.comMonetary Outreach AugieGeneral template,,,,,,,
Alisa SchilmoellerMarketing Manager3Mhttps://www.3m.com/aschilmoeller@mmm.comMonetary Outreach AugieGeneral template,,,,,,,
Eddie ByrdTalent Acquisition Sourcer3Mhttps://www.3m.com/ebyrd@mmm.comMonetary Outreach Augie General template,,,,,,,
Serin CrespoSr. Talent Acquisition Specialist3Mhttps://www.3m.com/screspo@mmm.comMonetary Outreach Augie General template,,,,,,,
Mark PaparoSr. Director Business DevelopmentAmtrakmark.paparo@amtrak.comMonetary Outreach JonasGeneral template,,,,,,,
Ian Hinke AVP Supply Chain management Amtrakian.hinke@amtrak.comMonetary Outreach JonasGeneral template,,,,,,,
Roger HarrisPresidentAmtrakroger.harris@amtrak.comMonetary Outreach JonasGeneral template,,,,,,,
"Costin CorneanuExecutive VP, Chief Financial OfficerAmtrakcostin.corneanu@amtrak.comMonetary Outreach JonasGeneral template",,,,,,,
"Eliot HamlischExecutive VP, Chief Commercial OfficerAmtrakeliot.hamlisch@amtrak.comMonetary Outreach JonasGeneral template",,,,,,,
"William HerrmannExec. VP, Chief Legal and HR Officer & Corporate SecretaryAmtrakwilliam.herrmann@amtrak.com Monetary Outreach JonasGeneral template",,,,,,,
"Bruno MaestriVice President, Gov. Affairs and Corp. Comm.Amtrakbruno.maestri@amtrak.com Monetary Outreach JonasGeneral template",,,,,,,
"Laura MasonExecutive VP, Capital DeliveryAmtraklaura.mason@amtrak.comMonetary Outreach JonasGeneral template",,,,,,,
"Jennifer MitchellExecutive VP, Strategy & PlanningAmtrakjennifer.mitchell@amtrak.comMonetary Outreach JonasGeneral template",,,,,,,
"Steve PredmoreExecutive VP, Chief Safety OfficerAmtraksteve.predmore@amtrak.comMonetary Outreach JonasGeneral template",,,,,,,
"Gerhard WilliamsExecutive VP, Service Delivery & OperationsAmtrakgerhard.williams@amtrak.comMonetary Outreach JonasGeneral template",,,,,,,
"Tracie WinbiglerExecutive VP, Chief Transformation OfficerAmtraktracie.winbigler@amtrak.comMonetary Outreach JonasGeneral template",,,,,,,
Anthony CosciaChairman of the BoardAmtrakanthony.coscia@amtrak.comMonetary Outreach JonasGeneral template,,,,,,,
Joel SzabatVice Chairman of the BoardAmtrakjoel.szabat@amtrak.comMonetary Outreach JonasGeneral template,,,,,,,
Steven SegerlinNationwide Advertising ManagerAmtraksteven.segerlin@amtrak.comMonetary Outreach JonasGeneral template,,,,,,,
"Edward LydeckerDirector, Business DevelopmentAmtrakedward.lydecker@amtrak.comMonetary Outreach JonasGeneral template",,,,,,,
"Eileen DowningDirector, Business DevelopmentAmtrakeileen.downing@amtrak.comMonetary Outreach JonasGeneral template",,,,,,,
"Mark PaparoSr. Director, Business Development - State Supported SvcsAmtrakmark.paparo@amtrak.comMonetary Outreach JonasGeneral template",,,,,,,
"Anabel FriasManager, Community EngagementAmtrakanabel.frias@amtrak.comMonetary Outreach JonasGeneral template",,,,,,,
Victor RomeroPresident/CEODelve Undergroundvictor.romero@delveunderground.comMonetary Outreach JonasGeneral template,,,,,,,
Gregg DavidsonChief Operations OfficerDelve Undergroundgregg.davidson@delveunderground.comMonetary Outreach JonasGeneral template,,,,,,,
Jason HaggardChief Financial OfficerDelve Undergroundjason.haggard@delveunderground.comMonetary Outreach JonasGeneral template,,,,,,,
John KaplinChief Development OfficerDelve Undergroundjohn.kaplin@delveunderground.comMonetary Outreach JonasGeneral template,,,,,,,
Frank LippertChief Strategy OfficerDelve Undergroundfrank.lippert@delveunderground.comMonetary Outreach JonasGeneral template,,,,,,,
Andres Trauttmansdorff-WeinsbergBusiness Development and Strategy LeadDelve Undergroundandres.trauttmansdorffweinsberg@delveunderground.comMonetary Outreach JonasGeneral template,,,,,,,
Jeannine AlexanderMarketing Leadership/SupportDelve Undergroundjeannine.alexander@delveunderground.comMonetary Outreach JonasGeneral template,,,,,,,
Andy OwenPrincipal (Business Development – Australia)Delve Undergroundandy.owen@delveunderground.comMonetary Outreach JonasGeneral template,,,,,,,
Brad MurrayPrincipal EngineerDelve Undergroundbrad.murray@delveunderground.comMonetary Outreach JonasGeneral template,,,,,,,
Dan Van RoosendaalPrincipalDelve Undergrounddan.vanroosendaal@delveunderground.comMonetary Outreach JonasGeneral template,,,,,,,
"Bade SozerPrincipal Engineer, Water Market Lead (East)Delve Undergroundbade.sozer@delveunderground.comMonetary Outreach JonasGeneral template",,,,,,,
John MurrayPrincipalDelve Undergroundjohn.murray@delveunderground.comMonetary Outreach JonasGeneral template,,,,,,,
Edward SturmLead AssociateDelve Undergroundedward.sturm@delveunderground.comMonetary Outreach JonasGeneral template,,,,,,,
Su SoeProject EngineerDelve Undergroundsu.soe@delveunderground.comMonetary Outreach JonasGeneral template,,,,,,,
Abby MottProject Controls CoordinatorDelve Undergroundabby.mott@delveunderground.comMonetary Outreach JonasGeneral template,,,,,,,
Katy HowellDirector of Marketing Operations and SponsorshipExxonMobilhttps://corporate.exxonmobil.com/kathleen.m.howell@exxonmobil.comMonetary Outreach Augie General template,,,,,,,
Lydia MaeleHead of Talent ExxonMobilhttps://corporate.exxonmobil.com/lydia.maele@exxonmobil.comMonetary Outreach Augie General template,,,,,,,
Michael FreemanTalent Development ManagerExxonMobilhttps://corporate.exxonmobil.com/michael@exxonmobil.comMonetary Outreach Augie General template,,,,,,,
Kim NewsomeUniversity Engagement Manager (UMich)ExxonMobilhttps://corporate.exxonmobil.com/kim.newsome@exxonmobil.comMonetary Outreach Augie General template,,,,,,,
Nivea RiveraBusiness DevelopmentSchnabel Engineeringhttps://www.schnabel-eng.com/contact/nrivera@schnabel-eng.comTunneling/Underground EngineeringAdlaiGeneral template,,,,,,,
Sho TahirovaSenior Business Development ManagerSchnabel Engineeringhttps://www.schnabel-eng.com/contact/stahirova@schnabel-eng.comTunneling/Underground EngineeringAdlaiGeneral template,,,,,,,
Christine FerrazzanoDirector of MarketingSchnabel Engineeringhttps://www.schnabel-eng.com/contact/cferrazzano@schnabel-eng.comTunneling/Underground EngineeringAdlaiGeneral template,,,,,,,
Brian BanksPrincipal/ Exec Vice President/ BD and Marketing LeaderSchnabel Engineeringhttps://www.schnabel-eng.com/contact/bbanks@schnabel-eng.comTunneling/Underground EngineeringAdlaiGeneral template,,,,,,,
Nick KirkpatrickMarketing CoordinatorBT Contruction Coloradohttps://www.btconstruction.comnick.kirkpatrick@btconstruction.comContruction and TBM ServicesAdlaiGeneral template,,,,,,,
Jordan HurdDirector of Risk Management & Project ManagerBT Contruction Coloradohttps://www.btconstruction.comjordan.hurd@btconstruction.comContruction and TBM ServicesAdlaiGeneral template,,,,,,,
Angela GoodmanDirector of Business DevelopmentBT Contruction Coloradohttps://www.btconstruction.comangela.goodman@btconstruction.comContruction and TBM ServicesAdlaiGeneral template,,,,,,,
Colin McCarronDirector of Open Cut EstimatingBT Contruction Coloradohttps://www.btconstruction.comcolin.mccarron@btconstruction.comContruction and TBM ServicesAdlaiGeneral template,,,,,,,
Stefan JohnsonDirector of Project ManagementBT Contruction Coloradohttps://www.btconstruction.comstefan.johnson@btconstruction.comContruction and TBM ServicesAdlaiGeneral template,,,,,,,
Josef BonnerPrincipal EngineerKilduff Undergroundhttps://www.kilduffunderground.comjbonner@kilduffunderground.comUnderground engineeringAdlaiGeneral template,,,,,,,
Deidra TuckerContent Marketing & Office AdministratorKilduff Undergroundhttps://www.kilduffunderground.comdtucker@kilduffunderground.comUnderground engineeringAdlaiGeneral template,,,,,,,
Kyle HindsSr. Project EngineerKilduff Undergroundhttps://www.kilduffunderground.comkhinds@kilduffunderground.comUnderground engineeringAdlaiGeneral template,,,,,,,
Todd KilduffPresidentKilduff Undergroundhttps://www.kilduffunderground.comtkilduff@kilduffunderground.comUnderground engineeringAdlaiGeneral template,,,,,,,
Dale PetersenSurvey Party ChiefKilduff Undergroundhttps://www.kilduffunderground.comdpetersen@kilduffunderground.comUnderground engineeringAdlaiGeneral template,,,,,,,
Ryan O'ConnellSenior EngineerKilduff Undergroundhttps://www.kilduffunderground.comroconnell@kilduffunderground.comUnderground engineeringAdlaiGeneral template,,,,,,,
Lauren LiewOffice AdministratorKilduff Undergroundhttps://www.kilduffunderground.comlliew@kilduffunderground.comUnderground engineeringAdlaiGeneral template,,,,,,,
Colleen KilduffOperations CoordinatorKilduff Undergroundhttps://www.kilduffunderground.comckilduff@kilduffunderground.comUnderground engineeringAdlaiGeneral template,,,,,,,
Angie HarveyOffice AdministratorKilduff Undergroundhttps://www.kilduffunderground.comaharvey@kilduffunderground.comUnderground engineeringAdlaiGeneral template,,,,,,,
Peter FlemingOwner/ConsultantKilduff Undergroundhttps://www.kilduffunderground.compfleming@kilduffunderground.comUnderground engineeringAdlaiGeneral template,,,,,,,
Jim JohnsonSenior Consultant - Trenchless/Civil/SubsurfaceKilduff Undergroundhttps://www.kilduffunderground.comjjohnson@kilduffunderground.comUnderground engineeringAdlaiGeneral template,,,,,,,
